lightllm/common/triton_utils/autotune_kernel_configs/triton_3.5.1/NVIDIA_GeForce_RTX_5090/fp8_scaled_mm_per_token:v3/{K=5120,N=5120,out_dtype=torch.bfloat16}_NVIDIA_GeForce_RTX_5090.json
{
  "257": {
    "BLOCK_K": 64,
    "BLOCK_M": 32,
    "BLOCK_N": 128,
    "GROUP_M": 8,
    "num_stages": 3,
    "num_warps": 8
  },
  "32130": {
    "BLOCK_K": 128,
    "BLOCK_M": 128,
    "BLOCK_N": 128,
    "GROUP_M": 16,
    "num_stages": 2,
    "num_warps": 4
  },
  "512": {
    "BLOCK_K": 128,
    "BLOCK_M": 128,
    "BLOCK_N": 128,
    "GROUP_M": 8,
    "num_stages": 4,
    "num_warps": 8
  },
  "75348": {
    "BLOCK_K": 128,
    "BLOCK_M": 128,
    "BLOCK_N": 128,
    "GROUP_M": 8,
    "num_stages": 2,
    "num_warps": 4
  }
}