lightllm/common/all_kernel_configs/_fwd_kernel_flash_decode_diverse_stage1:v1/{block_seq=256,gqa_group_size=8,out_dtype=torch.bfloat16,q_head_dim=128}_NVIDIA_GeForce_RTX_5090.json
{"4096": {"8": {"BLOCK_N": 64, "num_warps": 8, "num_stages": 1}, "32": {"BLOCK_N": 16, "num_warps": 2, "num_stages": 2}, "128": {"BLOCK_N": 16, "num_warps": 2, "num_stages": 5}, "256": {"BLOCK_N": 16, "num_warps": 2, "num_stages": 5}}, "8192": {"8": {"BLOCK_N": 16, "num_warps": 2, "num_stages": 1}, "32": {"BLOCK_N": 16, "num_warps": 2, "num_stages": 3}, "128": {"BLOCK_N": 16, "num_warps": 2, "num_stages": 5}, "256": {"BLOCK_N": 16, "num_warps": 2, "num_stages": 5}}}