lightllm/common/all_kernel_configs/_fwd_kernel_flash_decode_diverse_stage1:v1/{block_seq=256,gqa_group_size=16,out_dtype=torch.bfloat16,q_head_dim=128}_NVIDIA_H200.json
{"4096": {"8": {"BLOCK_N": 16, "num_warps": 4, "num_stages": 5}, "32": {"BLOCK_N": 16, "num_warps": 4, "num_stages": 10}, "128": {"BLOCK_N": 16, "num_warps": 4, "num_stages": 9}, "256": {"BLOCK_N": 16, "num_warps": 4, "num_stages": 9}}, "8192": {"8": {"BLOCK_N": 16, "num_warps": 4, "num_stages": 9}, "32": {"BLOCK_N": 16, "num_warps": 4, "num_stages": 10}, "128": {"BLOCK_N": 16, "num_warps": 4, "num_stages": 10}, "256": {"BLOCK_N": 16, "num_warps": 4, "num_stages": 9}}}