lightllm/common/triton_utils/autotune_kernel_configs/triton_3.5.1/NVIDIA_GeForce_RTX_5090/silu_and_mul_fwd:v1/{N=14336,out_dtype=torch.bfloat16}_NVIDIA_GeForce_RTX_5090.json
{
  "1": {
    "BLOCK_M": 32,
    "BLOCK_N": 128,
    "NUM_STAGES": 4,
    "num_warps": 1
  },
  "100": {
    "BLOCK_M": 8,
    "BLOCK_N": 256,
    "NUM_STAGES": 4,
    "num_warps": 4
  },
  "1024": {
    "BLOCK_M": 1,
    "BLOCK_N": 256,
    "NUM_STAGES": 1,
    "num_warps": 4
  },
  "128": {
    "BLOCK_M": 8,
    "BLOCK_N": 256,
    "NUM_STAGES": 1,
    "num_warps": 4
  },
  "16": {
    "BLOCK_M": 1,
    "BLOCK_N": 256,
    "NUM_STAGES": 2,
    "num_warps": 8
  },
  "2048": {
    "BLOCK_M": 256,
    "BLOCK_N": 256,
    "NUM_STAGES": 4,
    "num_warps": 4
  },
  "256": {
    "BLOCK_M": 8,
    "BLOCK_N": 128,
    "NUM_STAGES": 4,
    "num_warps": 1
  },
  "32": {
    "BLOCK_M": 1,
    "BLOCK_N": 256,
    "NUM_STAGES": 4,
    "num_warps": 1
  },
  "64": {
    "BLOCK_M": 8,
    "BLOCK_N": 256,
    "NUM_STAGES": 4,
    "num_warps": 4
  },
  "8": {
    "BLOCK_M": 1,
    "BLOCK_N": 128,
    "NUM_STAGES": 4,
    "num_warps": 1
  }
}